client_id	path	sentence	up_votes	down_votes	age	gender	accents	locale	segment
a84ef99930e5d7313b3af41e51e7ae67f8d9dffe969a7673a8b9894c46195720a8cf1402606b39c8d41517d37d48063cd3ff3c67a1bb29cbbbcfe34ca1978244	common_voice_ca_35056529.mp3	El vint-i-tres de maig na Cira i en Llop volen anar d'excursió.	2	0			central	ca	
a84ef99930e5d7313b3af41e51e7ae67f8d9dffe969a7673a8b9894c46195720a8cf1402606b39c8d41517d37d48063cd3ff3c67a1bb29cbbbcfe34ca1978244	common_voice_ca_35056530.mp3	Va entendre que a ell no l'intentarien salvar.	4	0			central	ca	
ebc9e7dc8cb6c1503a6e9226179d1f9dfc1cdb77761bc4773d0276f4a8698e5c8c8d8fda8be1c886bab4aecb091423cafe46158f33e0184f7a55fdd412f9e7c7	common_voice_ca_34930829.mp3	Es seus avis paterns eren el príncep de Wied, Hermann, i la princesa Maria de Nassau.	2	0				ca	
ebc9e7dc8cb6c1503a6e9226179d1f9dfc1cdb77761bc4773d0276f4a8698e5c8c8d8fda8be1c886bab4aecb091423cafe46158f33e0184f7a55fdd412f9e7c7	common_voice_ca_34930853.mp3	Per Cap d'Any en Llop i na Rita aniran a Meranges.	3	0				ca	
ebc9e7dc8cb6c1503a6e9226179d1f9dfc1cdb77761bc4773d0276f4a8698e5c8c8d8fda8be1c886bab4aecb091423cafe46158f33e0184f7a55fdd412f9e7c7	common_voice_ca_34938664.mp3	Dimarts en Joan i en Llop aniran a Vilassar de Mar.	2	0				ca	
ebc9e7dc8cb6c1503a6e9226179d1f9dfc1cdb77761bc4773d0276f4a8698e5c8c8d8fda8be1c886bab4aecb091423cafe46158f33e0184f7a55fdd412f9e7c7	common_voice_ca_34938696.mp3	Però s’hi repetirà l’esquema: piscina, música electrònica, camp de voleibol i ovelles.	2	0				ca	
ebc9e7dc8cb6c1503a6e9226179d1f9dfc1cdb77761bc4773d0276f4a8698e5c8c8d8fda8be1c886bab4aecb091423cafe46158f33e0184f7a55fdd412f9e7c7	common_voice_ca_34958394.mp3	Com serà la setmana segons preveu Oriol Junqueras?	2	0				ca	
ebc9e7dc8cb6c1503a6e9226179d1f9dfc1cdb77761bc4773d0276f4a8698e5c8c8d8fda8be1c886bab4aecb091423cafe46158f33e0184f7a55fdd412f9e7c7	common_voice_ca_34992844.mp3	Per Cap d'Any na Thaís i na Mireia iran a la Jonquera.	2	0				ca	
ebc9e7dc8cb6c1503a6e9226179d1f9dfc1cdb77761bc4773d0276f4a8698e5c8c8d8fda8be1c886bab4aecb091423cafe46158f33e0184f7a55fdd412f9e7c7	common_voice_ca_34992990.mp3	No hi ha cap més recepta per ajudar l'amiga.	2	1				ca	
ebc9e7dc8cb6c1503a6e9226179d1f9dfc1cdb77761bc4773d0276f4a8698e5c8c8d8fda8be1c886bab4aecb091423cafe46158f33e0184f7a55fdd412f9e7c7	common_voice_ca_35003326.mp3	El seu cognom és Chico: ce, hac, i, ce, o.	2	0				ca	
ebc9e7dc8cb6c1503a6e9226179d1f9dfc1cdb77761bc4773d0276f4a8698e5c8c8d8fda8be1c886bab4aecb091423cafe46158f33e0184f7a55fdd412f9e7c7	common_voice_ca_35027815.mp3	El vint-i-tres de maig en Jordi vol anar d'excursió.	2	0				ca	
ebc9e7dc8cb6c1503a6e9226179d1f9dfc1cdb77761bc4773d0276f4a8698e5c8c8d8fda8be1c886bab4aecb091423cafe46158f33e0184f7a55fdd412f9e7c7	common_voice_ca_35039136.mp3	Vull anar a Cortes d'Arenós amb autobús.	2	0				ca	
ebc9e7dc8cb6c1503a6e9226179d1f9dfc1cdb77761bc4773d0276f4a8698e5c8c8d8fda8be1c886bab4aecb091423cafe46158f33e0184f7a55fdd412f9e7c7	common_voice_ca_35099073.mp3	Estacions de servei per a tuaregs.	2	0				ca	
ebc9e7dc8cb6c1503a6e9226179d1f9dfc1cdb77761bc4773d0276f4a8698e5c8c8d8fda8be1c886bab4aecb091423cafe46158f33e0184f7a55fdd412f9e7c7	common_voice_ca_35106470.mp3	Per Cap d'Any na Queralt i n'Eulàlia van a Porreres.	2	0				ca	
ebc9e7dc8cb6c1503a6e9226179d1f9dfc1cdb77761bc4773d0276f4a8698e5c8c8d8fda8be1c886bab4aecb091423cafe46158f33e0184f7a55fdd412f9e7c7	common_voice_ca_35106485.mp3	Diumenge en Quirze i en Quel aniran a Almenara.	2	0				ca	
ebc9e7dc8cb6c1503a6e9226179d1f9dfc1cdb77761bc4773d0276f4a8698e5c8c8d8fda8be1c886bab4aecb091423cafe46158f33e0184f7a55fdd412f9e7c7	common_voice_ca_35106496.mp3	Jordi Colomí i Massanas és un polític nascut a l'Estartit.	2	0				ca	
ebc9e7dc8cb6c1503a6e9226179d1f9dfc1cdb77761bc4773d0276f4a8698e5c8c8d8fda8be1c886bab4aecb091423cafe46158f33e0184f7a55fdd412f9e7c7	common_voice_ca_35122638.mp3	Bufis i rebufis envoltat de molins.	2	0				ca	
192605a422f9a6a7a7b42e427762c03269ed05251f0822cf81abd18291f6212098aabe6344a5003f2c9d413e717489fd6a47964060d6b9761839eff8c3dc4863	common_voice_ca_35282668.mp3	El seu cognom és Morano: ema, o, erra, a, ena, o.	2	0	sixties	male	nord-occidental	ca	
192605a422f9a6a7a7b42e427762c03269ed05251f0822cf81abd18291f6212098aabe6344a5003f2c9d413e717489fd6a47964060d6b9761839eff8c3dc4863	common_voice_ca_35780811.mp3	Per Sant Jordi na Gal·la i en Guim volen anar a Cadaqués.	2	0	sixties	male	nord-occidental	ca	
192605a422f9a6a7a7b42e427762c03269ed05251f0822cf81abd18291f6212098aabe6344a5003f2c9d413e717489fd6a47964060d6b9761839eff8c3dc4863	common_voice_ca_35780613.mp3	Era molt crític amb el règim saudita i amb el príncep hereu.	2	0	sixties	male	nord-occidental	ca	
192605a422f9a6a7a7b42e427762c03269ed05251f0822cf81abd18291f6212098aabe6344a5003f2c9d413e717489fd6a47964060d6b9761839eff8c3dc4863	common_voice_ca_35781123.mp3	Si la misericòrdia és vertadera, has de patir el pecat veritable, no imaginari.	4	0	sixties	male	nord-occidental	ca	
192605a422f9a6a7a7b42e427762c03269ed05251f0822cf81abd18291f6212098aabe6344a5003f2c9d413e717489fd6a47964060d6b9761839eff8c3dc4863	common_voice_ca_35781263.mp3	El meu darrer comportament masclista?	2	0	sixties	male	nord-occidental	ca	
192605a422f9a6a7a7b42e427762c03269ed05251f0822cf81abd18291f6212098aabe6344a5003f2c9d413e717489fd6a47964060d6b9761839eff8c3dc4863	common_voice_ca_36008437.mp3	És una quincalla fonamentalment de valor sentimental que pertany a un dels meus empleats, encara que en podria obtenir una petita suma de diners en el mercat obert.	2	0	sixties	male	nord-occidental	ca	
192605a422f9a6a7a7b42e427762c03269ed05251f0822cf81abd18291f6212098aabe6344a5003f2c9d413e717489fd6a47964060d6b9761839eff8c3dc4863	common_voice_ca_36008531.mp3	Davant del foramen està el fòrnix i darrere el tàlem.	2	0	sixties	male	nord-occidental	ca	
192605a422f9a6a7a7b42e427762c03269ed05251f0822cf81abd18291f6212098aabe6344a5003f2c9d413e717489fd6a47964060d6b9761839eff8c3dc4863	common_voice_ca_36009130.mp3	Faith, a prop de Norwich.	4	0	sixties	male	nord-occidental	ca	
192605a422f9a6a7a7b42e427762c03269ed05251f0822cf81abd18291f6212098aabe6344a5003f2c9d413e717489fd6a47964060d6b9761839eff8c3dc4863	common_voice_ca_36009318.mp3	Inauguració oficial de l'edifici Moss Street City Arts.	2	0	sixties	male	nord-occidental	ca	
192605a422f9a6a7a7b42e427762c03269ed05251f0822cf81abd18291f6212098aabe6344a5003f2c9d413e717489fd6a47964060d6b9761839eff8c3dc4863	common_voice_ca_36009642.mp3	Jo això ho faig perquè m’ho crec.	4	0	sixties	male	nord-occidental	ca	
192605a422f9a6a7a7b42e427762c03269ed05251f0822cf81abd18291f6212098aabe6344a5003f2c9d413e717489fd6a47964060d6b9761839eff8c3dc4863	common_voice_ca_36009646.mp3	Aquesta col·laboració és molt necessària tenint en compte el nivell d’alerta actual.	2	0	sixties	male	nord-occidental	ca	
192605a422f9a6a7a7b42e427762c03269ed05251f0822cf81abd18291f6212098aabe6344a5003f2c9d413e717489fd6a47964060d6b9761839eff8c3dc4863	common_voice_ca_36009887.mp3	Després d'un últim "Viva Mexico", els Mexico Amigos es van separar.	4	0	sixties	male	nord-occidental	ca	
192605a422f9a6a7a7b42e427762c03269ed05251f0822cf81abd18291f6212098aabe6344a5003f2c9d413e717489fd6a47964060d6b9761839eff8c3dc4863	common_voice_ca_36453213.mp3	Per Sant Jordi en Genís i en Milos voldrien anar a Santa Maria d'Oló.	2	0	sixties	male	nord-occidental	ca	
192605a422f9a6a7a7b42e427762c03269ed05251f0822cf81abd18291f6212098aabe6344a5003f2c9d413e717489fd6a47964060d6b9761839eff8c3dc4863	common_voice_ca_36453259.mp3	La nervadura d'arc ogival va ser construïda sense morter entre les dovelles.	2	0	sixties	male	nord-occidental	ca	
192605a422f9a6a7a7b42e427762c03269ed05251f0822cf81abd18291f6212098aabe6344a5003f2c9d413e717489fd6a47964060d6b9761839eff8c3dc4863	common_voice_ca_36453256.mp3	Ha carbassejat el seu veí.	2	0	sixties	male	nord-occidental	ca	
192605a422f9a6a7a7b42e427762c03269ed05251f0822cf81abd18291f6212098aabe6344a5003f2c9d413e717489fd6a47964060d6b9761839eff8c3dc4863	common_voice_ca_36473898.mp3	No hi ha imatges no hi ha imatges no hi ha imatges no hi ha imatges no hi ha imatges no hi ha imatges	2	0	sixties	male	nord-occidental	ca	
4c2fd0492e21b6d32a30a1c688554fca1aac1a6e4a69d99e36768d4755cd46c8a0a3075f85fcf1973cb02b732a3c2448323b9da3625e2ddb14a6d5139db996a8	common_voice_ca_35881152.mp3	Diumenge en Genís i en Martí van a Orpí.	2	0			central	ca	
4c2fd0492e21b6d32a30a1c688554fca1aac1a6e4a69d99e36768d4755cd46c8a0a3075f85fcf1973cb02b732a3c2448323b9da3625e2ddb14a6d5139db996a8	common_voice_ca_35882628.mp3	Demà na Carlota i na Lola volen anar a Xodos.	2	0	sixties	male	central	ca	
4c2fd0492e21b6d32a30a1c688554fca1aac1a6e4a69d99e36768d4755cd46c8a0a3075f85fcf1973cb02b732a3c2448323b9da3625e2ddb14a6d5139db996a8	common_voice_ca_35883207.mp3	Dimecres na Mireia anirà a Sant Antoni de Benaixeve.	2	0	sixties	male	central	ca	
4c2fd0492e21b6d32a30a1c688554fca1aac1a6e4a69d99e36768d4755cd46c8a0a3075f85fcf1973cb02b732a3c2448323b9da3625e2ddb14a6d5139db996a8	common_voice_ca_36310541.mp3	El vint-i-nou de febrer na Rosó i na Noa volen anar a la platja.	2	0	sixties	male	central	ca	
4c2fd0492e21b6d32a30a1c688554fca1aac1a6e4a69d99e36768d4755cd46c8a0a3075f85fcf1973cb02b732a3c2448323b9da3625e2ddb14a6d5139db996a8	common_voice_ca_36310584.mp3	Per Sant Jordi na Joana vol anar a Rocafort de Queralt.	4	0	sixties	male	central	ca	
4c2fd0492e21b6d32a30a1c688554fca1aac1a6e4a69d99e36768d4755cd46c8a0a3075f85fcf1973cb02b732a3c2448323b9da3625e2ddb14a6d5139db996a8	common_voice_ca_36310635.mp3	Cayuga està situat a la riba oriental de l'extrem nord del llac Cayuga.	2	0	sixties	male	central	ca	
4c2fd0492e21b6d32a30a1c688554fca1aac1a6e4a69d99e36768d4755cd46c8a0a3075f85fcf1973cb02b732a3c2448323b9da3625e2ddb14a6d5139db996a8	common_voice_ca_36310675.mp3	Per damunt d'aquest cos, n'hi ha dos més, de secció circular.	2	0	sixties	male	central	ca	
4c2fd0492e21b6d32a30a1c688554fca1aac1a6e4a69d99e36768d4755cd46c8a0a3075f85fcf1973cb02b732a3c2448323b9da3625e2ddb14a6d5139db996a8	common_voice_ca_36310817.mp3	Incloïa una ciutadella a Saint Martin.	2	0	sixties	male	central	ca	
4c2fd0492e21b6d32a30a1c688554fca1aac1a6e4a69d99e36768d4755cd46c8a0a3075f85fcf1973cb02b732a3c2448323b9da3625e2ddb14a6d5139db996a8	common_voice_ca_36310932.mp3	Guarda el sis, zero, cinc, seixanta-set, onze, zero, u com a telèfon de la Blau Ahumada.	4	0	sixties	male	central	ca	
4c2fd0492e21b6d32a30a1c688554fca1aac1a6e4a69d99e36768d4755cd46c8a0a3075f85fcf1973cb02b732a3c2448323b9da3625e2ddb14a6d5139db996a8	common_voice_ca_36310936.mp3	Llavors va tranquil·litzar els familiars i els va donar esperances.	2	0	sixties	male	central	ca	
4c2fd0492e21b6d32a30a1c688554fca1aac1a6e4a69d99e36768d4755cd46c8a0a3075f85fcf1973cb02b732a3c2448323b9da3625e2ddb14a6d5139db996a8	common_voice_ca_36310795.mp3	És clar que tampoc era molt gran, però era un canvi.	2	0	sixties	male	central	ca	
4c2fd0492e21b6d32a30a1c688554fca1aac1a6e4a69d99e36768d4755cd46c8a0a3075f85fcf1973cb02b732a3c2448323b9da3625e2ddb14a6d5139db996a8	common_voice_ca_36311008.mp3	Per Cap d'Any na Frida i en Rauric aniran a la biblioteca.	4	0	sixties	male	central	ca	
4c2fd0492e21b6d32a30a1c688554fca1aac1a6e4a69d99e36768d4755cd46c8a0a3075f85fcf1973cb02b732a3c2448323b9da3625e2ddb14a6d5139db996a8	common_voice_ca_36407544.mp3	Diumenge en Sergi i na Laia iran a Agres.	2	0	sixties	male	central	ca	
4c2fd0492e21b6d32a30a1c688554fca1aac1a6e4a69d99e36768d4755cd46c8a0a3075f85fcf1973cb02b732a3c2448323b9da3625e2ddb14a6d5139db996a8	common_voice_ca_36407613.mp3	Està situat al llarg del llac Ohrid, al sud de la ciutat d'Ohrid.	2	0	sixties	male	central	ca	
4c2fd0492e21b6d32a30a1c688554fca1aac1a6e4a69d99e36768d4755cd46c8a0a3075f85fcf1973cb02b732a3c2448323b9da3625e2ddb14a6d5139db996a8	common_voice_ca_36433911.mp3	Diumenge na Dolça i en Quixot iran a Manlleu.	2	0	sixties	male	central	ca	
4c2fd0492e21b6d32a30a1c688554fca1aac1a6e4a69d99e36768d4755cd46c8a0a3075f85fcf1973cb02b732a3c2448323b9da3625e2ddb14a6d5139db996a8	common_voice_ca_36440197.mp3	El deu d'agost na Gemma i en Drac van a Òrrius.	2	0	sixties	male	central	ca	
4c2fd0492e21b6d32a30a1c688554fca1aac1a6e4a69d99e36768d4755cd46c8a0a3075f85fcf1973cb02b732a3c2448323b9da3625e2ddb14a6d5139db996a8	common_voice_ca_36497812.mp3	El deu d'agost en Guerau i en Damià aniran a Alfafara.	2	0	sixties	male	central	ca	
4c2fd0492e21b6d32a30a1c688554fca1aac1a6e4a69d99e36768d4755cd46c8a0a3075f85fcf1973cb02b732a3c2448323b9da3625e2ddb14a6d5139db996a8	common_voice_ca_36497841.mp3	Galileu parlava de Saturn.	2	0	sixties	male	central	ca	
4c2fd0492e21b6d32a30a1c688554fca1aac1a6e4a69d99e36768d4755cd46c8a0a3075f85fcf1973cb02b732a3c2448323b9da3625e2ddb14a6d5139db996a8	common_voice_ca_36497897.mp3	Dimarts na Queralt i na Lia aniran a Sant Hipòlit de Voltregà.	2	0	sixties	male	central	ca	
65631e294674d9db6dab28dabce6470b9b413cedc9da658aa4dd8cd7e39dbd4c842426697c5bfd58eeb651ff636cf6c561f57af94f6eb10f78458708031daaad	common_voice_ca_35006875.mp3	Diumenge na Cira i en Gil iran a Torrent.	2	0				ca	
65631e294674d9db6dab28dabce6470b9b413cedc9da658aa4dd8cd7e39dbd4c842426697c5bfd58eeb651ff636cf6c561f57af94f6eb10f78458708031daaad	common_voice_ca_35012353.mp3	Va tornar a mirar a dreta i esquerra.	2	0				ca	
65631e294674d9db6dab28dabce6470b9b413cedc9da658aa4dd8cd7e39dbd4c842426697c5bfd58eeb651ff636cf6c561f57af94f6eb10f78458708031daaad	common_voice_ca_35012583.mp3	El vint-i-tres de maig na Xènia i na Mireia volen anar al teatre.	2	0				ca	
65631e294674d9db6dab28dabce6470b9b413cedc9da658aa4dd8cd7e39dbd4c842426697c5bfd58eeb651ff636cf6c561f57af94f6eb10f78458708031daaad	common_voice_ca_35012657.mp3	Sota la seva jurisdicció es trobaven les forces republicanes desplegades a Andalusia Oriental.	3	0				ca	
65631e294674d9db6dab28dabce6470b9b413cedc9da658aa4dd8cd7e39dbd4c842426697c5bfd58eeb651ff636cf6c561f57af94f6eb10f78458708031daaad	common_voice_ca_35043841.mp3	Víctor Rodríguez Romero és un futbolista nascut a Barcelona.	2	0				ca	
65631e294674d9db6dab28dabce6470b9b413cedc9da658aa4dd8cd7e39dbd4c842426697c5bfd58eeb651ff636cf6c561f57af94f6eb10f78458708031daaad	common_voice_ca_35044115.mp3	Demà en Guillem i en Marc aniran a Borriana.	2	1				ca	
65631e294674d9db6dab28dabce6470b9b413cedc9da658aa4dd8cd7e39dbd4c842426697c5bfd58eeb651ff636cf6c561f57af94f6eb10f78458708031daaad	common_voice_ca_35089406.mp3	Dissabte en Tom i en Magí volen anar a la platja.	2	0				ca	
65631e294674d9db6dab28dabce6470b9b413cedc9da658aa4dd8cd7e39dbd4c842426697c5bfd58eeb651ff636cf6c561f57af94f6eb10f78458708031daaad	common_voice_ca_35089450.mp3	El vint-i-nou de febrer en Guim vol anar a Santa Oliva.	2	1				ca	
65631e294674d9db6dab28dabce6470b9b413cedc9da658aa4dd8cd7e39dbd4c842426697c5bfd58eeb651ff636cf6c561f57af94f6eb10f78458708031daaad	common_voice_ca_35089489.mp3	Va exposar la seva obra en locals tan distingits com la confiteria de Pere Llibre.	2	0				ca	
65631e294674d9db6dab28dabce6470b9b413cedc9da658aa4dd8cd7e39dbd4c842426697c5bfd58eeb651ff636cf6c561f57af94f6eb10f78458708031daaad	common_voice_ca_35089631.mp3	Dijous en Biel i na Gina volen anar d'excursió.	2	0				ca	
65631e294674d9db6dab28dabce6470b9b413cedc9da658aa4dd8cd7e39dbd4c842426697c5bfd58eeb651ff636cf6c561f57af94f6eb10f78458708031daaad	common_voice_ca_35089404.mp3	Va argumentar que havien sobrat trenta-una dosis que s’haurien fet malbé.	2	0				ca	
65631e294674d9db6dab28dabce6470b9b413cedc9da658aa4dd8cd7e39dbd4c842426697c5bfd58eeb651ff636cf6c561f57af94f6eb10f78458708031daaad	common_voice_ca_35170995.mp3	Els xarnegos comunistes han de quedar fora del govern del municipi.	2	0				ca	
65631e294674d9db6dab28dabce6470b9b413cedc9da658aa4dd8cd7e39dbd4c842426697c5bfd58eeb651ff636cf6c561f57af94f6eb10f78458708031daaad	common_voice_ca_35171010.mp3	Diumenge en David i na Xènia iran a Guardiola de Berguedà.	2	0				ca	
65631e294674d9db6dab28dabce6470b9b413cedc9da658aa4dd8cd7e39dbd4c842426697c5bfd58eeb651ff636cf6c561f57af94f6eb10f78458708031daaad	common_voice_ca_35204797.mp3	Quina idea del progrés ens volen imposar?	2	0				ca	
65631e294674d9db6dab28dabce6470b9b413cedc9da658aa4dd8cd7e39dbd4c842426697c5bfd58eeb651ff636cf6c561f57af94f6eb10f78458708031daaad	common_voice_ca_35205001.mp3	Quan s'apassiona per una cosa de vegades s'accelera massa.	2	0				ca	
65631e294674d9db6dab28dabce6470b9b413cedc9da658aa4dd8cd7e39dbd4c842426697c5bfd58eeb651ff636cf6c561f57af94f6eb10f78458708031daaad	common_voice_ca_35415564.mp3	Diumenge en Quer i na Dúnia aniran a Guissona.	2	0				ca	
65631e294674d9db6dab28dabce6470b9b413cedc9da658aa4dd8cd7e39dbd4c842426697c5bfd58eeb651ff636cf6c561f57af94f6eb10f78458708031daaad	common_voice_ca_35415833.mp3	Sóc enemic dels japonesos.	2	0				ca	
65631e294674d9db6dab28dabce6470b9b413cedc9da658aa4dd8cd7e39dbd4c842426697c5bfd58eeb651ff636cf6c561f57af94f6eb10f78458708031daaad	common_voice_ca_35415857.mp3	La comunitat no incorporada de Czechville es troba a la ciutat.	2	0				ca	
65631e294674d9db6dab28dabce6470b9b413cedc9da658aa4dd8cd7e39dbd4c842426697c5bfd58eeb651ff636cf6c561f57af94f6eb10f78458708031daaad	common_voice_ca_36489252.mp3	Es poden fer coses per reduir el risc significativament, però cal espavilar-se.	2	0				ca	
65631e294674d9db6dab28dabce6470b9b413cedc9da658aa4dd8cd7e39dbd4c842426697c5bfd58eeb651ff636cf6c561f57af94f6eb10f78458708031daaad	common_voice_ca_36500580.mp3	Aquelles carreteres mal engravades	2	0				ca	
7caf2af78fac7e7f359f152a7b2261dc33c3499cf4434ec92151331764569bdb0914eb60415f228050c76557ccf969f3c9a5f903ebcc62e86618c2817af56f05	common_voice_ca_35185163.mp3	Dimecres en Cesc irà a la platja.	2	0			central	ca	
7caf2af78fac7e7f359f152a7b2261dc33c3499cf4434ec92151331764569bdb0914eb60415f228050c76557ccf969f3c9a5f903ebcc62e86618c2817af56f05	common_voice_ca_35185166.mp3	El nou d'octubre ma germana irà d'excursió.	4	0			central	ca	
7caf2af78fac7e7f359f152a7b2261dc33c3499cf4434ec92151331764569bdb0914eb60415f228050c76557ccf969f3c9a5f903ebcc62e86618c2817af56f05	common_voice_ca_35185168.mp3	El rebrem amb molta estimació, ha dit.	4	0			central	ca	
7caf2af78fac7e7f359f152a7b2261dc33c3499cf4434ec92151331764569bdb0914eb60415f228050c76557ccf969f3c9a5f903ebcc62e86618c2817af56f05	common_voice_ca_35185171.mp3	Però el relat del conductor no concorda amb la informació de què disposem.	2	0			central	ca	
7caf2af78fac7e7f359f152a7b2261dc33c3499cf4434ec92151331764569bdb0914eb60415f228050c76557ccf969f3c9a5f903ebcc62e86618c2817af56f05	common_voice_ca_35185189.mp3	Alcanar es un poble del Montsià	4	0			central	ca	
7caf2af78fac7e7f359f152a7b2261dc33c3499cf4434ec92151331764569bdb0914eb60415f228050c76557ccf969f3c9a5f903ebcc62e86618c2817af56f05	common_voice_ca_35185195.mp3	Perquè entre altres coses tenim codis deontològics que complim.	4	0			central	ca	
7caf2af78fac7e7f359f152a7b2261dc33c3499cf4434ec92151331764569bdb0914eb60415f228050c76557ccf969f3c9a5f903ebcc62e86618c2817af56f05	common_voice_ca_35185196.mp3	En el llarg camí que recorre podem definir tres etapes.	2	0			central	ca	
7caf2af78fac7e7f359f152a7b2261dc33c3499cf4434ec92151331764569bdb0914eb60415f228050c76557ccf969f3c9a5f903ebcc62e86618c2817af56f05	common_voice_ca_35250931.mp3	Tant el mobiliari com els objectes sacres, sense oblidar les estàtues van ser cremats.	2	0			central	ca	
7caf2af78fac7e7f359f152a7b2261dc33c3499cf4434ec92151331764569bdb0914eb60415f228050c76557ccf969f3c9a5f903ebcc62e86618c2817af56f05	common_voice_ca_35250936.mp3	Pape té tres fills i nou néts.	4	0			central	ca	
7caf2af78fac7e7f359f152a7b2261dc33c3499cf4434ec92151331764569bdb0914eb60415f228050c76557ccf969f3c9a5f903ebcc62e86618c2817af56f05	common_voice_ca_35250968.mp3	Parla, un cop més, amb els seus advocats.	4	0			central	ca	
7caf2af78fac7e7f359f152a7b2261dc33c3499cf4434ec92151331764569bdb0914eb60415f228050c76557ccf969f3c9a5f903ebcc62e86618c2817af56f05	common_voice_ca_35250927.mp3	Les protestes s’expandeixen per tot el país, creixen en nombre i guanyen consistència.	2	0			central	ca	
7caf2af78fac7e7f359f152a7b2261dc33c3499cf4434ec92151331764569bdb0914eb60415f228050c76557ccf969f3c9a5f903ebcc62e86618c2817af56f05	common_voice_ca_35251238.mp3	Jocs Mediterranis a Mersin.	2	0			central	ca	
7caf2af78fac7e7f359f152a7b2261dc33c3499cf4434ec92151331764569bdb0914eb60415f228050c76557ccf969f3c9a5f903ebcc62e86618c2817af56f05	common_voice_ca_35744841.mp3	Els murs, que són de paredat, estan arrebossats i les obertures emmarcades i pintades.	6	0			central	ca	
7caf2af78fac7e7f359f152a7b2261dc33c3499cf4434ec92151331764569bdb0914eb60415f228050c76557ccf969f3c9a5f903ebcc62e86618c2817af56f05	common_voice_ca_35744844.mp3	Enric Borràs i Oriol va ser un actor nascut a Badalona.	2	0			central	ca	
7caf2af78fac7e7f359f152a7b2261dc33c3499cf4434ec92151331764569bdb0914eb60415f228050c76557ccf969f3c9a5f903ebcc62e86618c2817af56f05	common_voice_ca_35744583.mp3	Depèn dels resultats de la lluita contra la pandèmia.	2	0			central	ca	
7caf2af78fac7e7f359f152a7b2261dc33c3499cf4434ec92151331764569bdb0914eb60415f228050c76557ccf969f3c9a5f903ebcc62e86618c2817af56f05	common_voice_ca_35744948.mp3	El vint-i-tres de maig en Jordi i en Damià aniran a Vilafant.	2	0			central	ca	
7caf2af78fac7e7f359f152a7b2261dc33c3499cf4434ec92151331764569bdb0914eb60415f228050c76557ccf969f3c9a5f903ebcc62e86618c2817af56f05	common_voice_ca_35744978.mp3	Dimarts en Max va a Navata.	2	0			central	ca	
7caf2af78fac7e7f359f152a7b2261dc33c3499cf4434ec92151331764569bdb0914eb60415f228050c76557ccf969f3c9a5f903ebcc62e86618c2817af56f05	common_voice_ca_35744999.mp3	La mutació britànica és una variant i no una soca: quina implicació té?	2	0			central	ca	
7caf2af78fac7e7f359f152a7b2261dc33c3499cf4434ec92151331764569bdb0914eb60415f228050c76557ccf969f3c9a5f903ebcc62e86618c2817af56f05	common_voice_ca_35745032.mp3	El pare Claret —m'ajuda el Carmany.	2	0			central	ca	
7caf2af78fac7e7f359f152a7b2261dc33c3499cf4434ec92151331764569bdb0914eb60415f228050c76557ccf969f3c9a5f903ebcc62e86618c2817af56f05	common_voice_ca_35745308.mp3	Dissabte en Garbí i na Dúnia iran a Costitx.	2	0			central	ca	
967d23f93251965620d2a692969aabb61ca641776419f0a4001c980423feaa663a26e822238755637c0b1e62247f848ddc2b75a6bfe55af50caa5a4ff6b28ca2	common_voice_ca_34938171.mp3	Dimarts en Rauric i na Cira iran a Almedíxer.	4	0	sixties		valencià	ca	
967d23f93251965620d2a692969aabb61ca641776419f0a4001c980423feaa663a26e822238755637c0b1e62247f848ddc2b75a6bfe55af50caa5a4ff6b28ca2	common_voice_ca_34938188.mp3	Antoni Xuclà i Bas va ser un polític nascut a Manlleu.	4	0	sixties		valencià	ca	
967d23f93251965620d2a692969aabb61ca641776419f0a4001c980423feaa663a26e822238755637c0b1e62247f848ddc2b75a6bfe55af50caa5a4ff6b28ca2	common_voice_ca_34938213.mp3	Joan Reñé i Huguet és un polític nascut a Fondarella.	4	0	sixties		valencià	ca	
967d23f93251965620d2a692969aabb61ca641776419f0a4001c980423feaa663a26e822238755637c0b1e62247f848ddc2b75a6bfe55af50caa5a4ff6b28ca2	common_voice_ca_34938232.mp3	El vint-i-nou de febrer na Bruna i na Zoè aniran al teatre.	2	0	sixties		valencià	ca	
967d23f93251965620d2a692969aabb61ca641776419f0a4001c980423feaa663a26e822238755637c0b1e62247f848ddc2b75a6bfe55af50caa5a4ff6b28ca2	common_voice_ca_34938239.mp3	Per Cap d'Any na Neus vol anar a Castell de Mur.	4	0	sixties		valencià	ca	
967d23f93251965620d2a692969aabb61ca641776419f0a4001c980423feaa663a26e822238755637c0b1e62247f848ddc2b75a6bfe55af50caa5a4ff6b28ca2	common_voice_ca_34938247.mp3	Un coll net resulta en un collar net.	4	0	sixties		valencià	ca	
967d23f93251965620d2a692969aabb61ca641776419f0a4001c980423feaa663a26e822238755637c0b1e62247f848ddc2b75a6bfe55af50caa5a4ff6b28ca2	common_voice_ca_34938268.mp3	Dimarts na Duna i en Miquel van a Esplugues de Llobregat.	6	0	sixties		valencià	ca	
967d23f93251965620d2a692969aabb61ca641776419f0a4001c980423feaa663a26e822238755637c0b1e62247f848ddc2b75a6bfe55af50caa5a4ff6b28ca2	common_voice_ca_34938281.mp3	Dissabte en Lleó vol anar a Santa Oliva.	2	0	sixties		valencià	ca	
967d23f93251965620d2a692969aabb61ca641776419f0a4001c980423feaa663a26e822238755637c0b1e62247f848ddc2b75a6bfe55af50caa5a4ff6b28ca2	common_voice_ca_34938290.mp3	I en allò que hi ha dins de cadascun dels personatges.	2	0	sixties		valencià	ca	
967d23f93251965620d2a692969aabb61ca641776419f0a4001c980423feaa663a26e822238755637c0b1e62247f848ddc2b75a6bfe55af50caa5a4ff6b28ca2	common_voice_ca_34938295.mp3	Tots els altres van sortir il·lesos de l'avió.	4	0	sixties		valencià	ca	
967d23f93251965620d2a692969aabb61ca641776419f0a4001c980423feaa663a26e822238755637c0b1e62247f848ddc2b75a6bfe55af50caa5a4ff6b28ca2	common_voice_ca_34949179.mp3	Diumenge en Gerard i na Blau volen anar a l'Alcúdia.	2	0	sixties		valencià	ca	
967d23f93251965620d2a692969aabb61ca641776419f0a4001c980423feaa663a26e822238755637c0b1e62247f848ddc2b75a6bfe55af50caa5a4ff6b28ca2	common_voice_ca_34949180.mp3	Un soroll sec s'apodera del silenci.	2	0	sixties		valencià	ca	
967d23f93251965620d2a692969aabb61ca641776419f0a4001c980423feaa663a26e822238755637c0b1e62247f848ddc2b75a6bfe55af50caa5a4ff6b28ca2	common_voice_ca_34953927.mp3	Nosaltres no entrarem en això.	4	0	sixties		valencià	ca	
967d23f93251965620d2a692969aabb61ca641776419f0a4001c980423feaa663a26e822238755637c0b1e62247f848ddc2b75a6bfe55af50caa5a4ff6b28ca2	common_voice_ca_34953935.mp3	Per això, el govern francès els facilita proves de franc a les farmàcies.	2	0	sixties		valencià	ca	
967d23f93251965620d2a692969aabb61ca641776419f0a4001c980423feaa663a26e822238755637c0b1e62247f848ddc2b75a6bfe55af50caa5a4ff6b28ca2	common_voice_ca_34953937.mp3	Demà passat na Neida i en Juli aniran a Búger.	4	0	sixties		valencià	ca	
967d23f93251965620d2a692969aabb61ca641776419f0a4001c980423feaa663a26e822238755637c0b1e62247f848ddc2b75a6bfe55af50caa5a4ff6b28ca2	common_voice_ca_34953967.mp3	Divendres ma germana vol anar d'excursió.	2	0	sixties		valencià	ca	
967d23f93251965620d2a692969aabb61ca641776419f0a4001c980423feaa663a26e822238755637c0b1e62247f848ddc2b75a6bfe55af50caa5a4ff6b28ca2	common_voice_ca_34953983.mp3	Era l'única fotoperiodista de l'edifici.	4	0	sixties		valencià	ca	
