client_id	path	sentence	up_votes	down_votes	age	gender	accents	locale	segment
85c9e13ccfc0d67de10281b04257d8ac0c256d2f9415e54148fb59954c0d43f66d3cbea43ea6389f8407a8bda8b1b1becd30e41dfbb3dd9bebbe69816d096fa9	common_voice_ca_35047297.mp3	La clau serà si aquesta situació es repeteix en les següents eleccions.	3	0	sixties	male	central	ca	
85c9e13ccfc0d67de10281b04257d8ac0c256d2f9415e54148fb59954c0d43f66d3cbea43ea6389f8407a8bda8b1b1becd30e41dfbb3dd9bebbe69816d096fa9	common_voice_ca_35047360.mp3	I per això la nostra presó és clarament injusta.	2	0	sixties	male	central	ca	
85c9e13ccfc0d67de10281b04257d8ac0c256d2f9415e54148fb59954c0d43f66d3cbea43ea6389f8407a8bda8b1b1becd30e41dfbb3dd9bebbe69816d096fa9	common_voice_ca_35047403.mp3	El nou d'octubre n'Eulàlia i en Guim aniran a Castelló de la Plana.	2	0	sixties	male	central	ca	
85c9e13ccfc0d67de10281b04257d8ac0c256d2f9415e54148fb59954c0d43f66d3cbea43ea6389f8407a8bda8b1b1becd30e41dfbb3dd9bebbe69816d096fa9	common_voice_ca_35047429.mp3	En principi els dius que tot segueix tal com estava previst i llestos.	2	0	sixties	male	central	ca	
85c9e13ccfc0d67de10281b04257d8ac0c256d2f9415e54148fb59954c0d43f66d3cbea43ea6389f8407a8bda8b1b1becd30e41dfbb3dd9bebbe69816d096fa9	common_voice_ca_35106225.mp3	El vint-i-nou de febrer na Gemma i en Dan aniran al teatre.	2	0	sixties	male	central	ca	
85c9e13ccfc0d67de10281b04257d8ac0c256d2f9415e54148fb59954c0d43f66d3cbea43ea6389f8407a8bda8b1b1becd30e41dfbb3dd9bebbe69816d096fa9	common_voice_ca_35106261.mp3	Dijous en Roger anirà a la biblioteca.	3	0	sixties	male	central	ca	
85c9e13ccfc0d67de10281b04257d8ac0c256d2f9415e54148fb59954c0d43f66d3cbea43ea6389f8407a8bda8b1b1becd30e41dfbb3dd9bebbe69816d096fa9	common_voice_ca_35110596.mp3	Divendres en Sol anirà al teatre.	2	0	sixties	male	central	ca	
85c9e13ccfc0d67de10281b04257d8ac0c256d2f9415e54148fb59954c0d43f66d3cbea43ea6389f8407a8bda8b1b1becd30e41dfbb3dd9bebbe69816d096fa9	common_voice_ca_35110605.mp3	El fracàs de la política ens va portar a la via judicial.	2	0	sixties	male	central	ca	
85c9e13ccfc0d67de10281b04257d8ac0c256d2f9415e54148fb59954c0d43f66d3cbea43ea6389f8407a8bda8b1b1becd30e41dfbb3dd9bebbe69816d096fa9	common_voice_ca_35110614.mp3	Demà na Rosó anirà a Borrassà.	2	0	sixties	male	central	ca	
85c9e13ccfc0d67de10281b04257d8ac0c256d2f9415e54148fb59954c0d43f66d3cbea43ea6389f8407a8bda8b1b1becd30e41dfbb3dd9bebbe69816d096fa9	common_voice_ca_35157063.mp3	Dissabte na Damià i na Dolça aniran a Santa Perpètua de Mogoda.	2	0	sixties	male	central	ca	
85c9e13ccfc0d67de10281b04257d8ac0c256d2f9415e54148fb59954c0d43f66d3cbea43ea6389f8407a8bda8b1b1becd30e41dfbb3dd9bebbe69816d096fa9	common_voice_ca_35157134.mp3	Dijous en Guerau i na Blanca iran a Bonastre.	2	0	sixties	male	central	ca	
85c9e13ccfc0d67de10281b04257d8ac0c256d2f9415e54148fb59954c0d43f66d3cbea43ea6389f8407a8bda8b1b1becd30e41dfbb3dd9bebbe69816d096fa9	common_voice_ca_35157137.mp3	Música, teatre, arts escèniques, exposicions i activitats familiars per a tot tipus de públic.	2	0	sixties	male	central	ca	
85c9e13ccfc0d67de10281b04257d8ac0c256d2f9415e54148fb59954c0d43f66d3cbea43ea6389f8407a8bda8b1b1becd30e41dfbb3dd9bebbe69816d096fa9	common_voice_ca_35252078.mp3	Actualment s'ha convertit en un allotjament o casa rural, que permet allotjament al turisme rural.	2	0	sixties	male	central	ca	
85c9e13ccfc0d67de10281b04257d8ac0c256d2f9415e54148fb59954c0d43f66d3cbea43ea6389f8407a8bda8b1b1becd30e41dfbb3dd9bebbe69816d096fa9	common_voice_ca_35266782.mp3	De quin color t'agrada més?	2	0	sixties	male	central	ca	
85c9e13ccfc0d67de10281b04257d8ac0c256d2f9415e54148fb59954c0d43f66d3cbea43ea6389f8407a8bda8b1b1becd30e41dfbb3dd9bebbe69816d096fa9	common_voice_ca_35266797.mp3	El deu d'agost en Nil i en Quer aniran d'excursió.	2	0	sixties	male	central	ca	
85c9e13ccfc0d67de10281b04257d8ac0c256d2f9415e54148fb59954c0d43f66d3cbea43ea6389f8407a8bda8b1b1becd30e41dfbb3dd9bebbe69816d096fa9	common_voice_ca_35266806.mp3	Tots els que s'havien revoltat contra la seva autoritat van acabar sotmesos.	2	0	sixties	male	central	ca	
85c9e13ccfc0d67de10281b04257d8ac0c256d2f9415e54148fb59954c0d43f66d3cbea43ea6389f8407a8bda8b1b1becd30e41dfbb3dd9bebbe69816d096fa9	common_voice_ca_35266816.mp3	La Sal seu al llit, molt a prop del malalt.	2	0	sixties	male	central	ca	
85c9e13ccfc0d67de10281b04257d8ac0c256d2f9415e54148fb59954c0d43f66d3cbea43ea6389f8407a8bda8b1b1becd30e41dfbb3dd9bebbe69816d096fa9	common_voice_ca_35266825.mp3	El vint-i-nou de febrer na Marta i en Tom aniran a Alcosser.	2	0	sixties	male	central	ca	
85c9e13ccfc0d67de10281b04257d8ac0c256d2f9415e54148fb59954c0d43f66d3cbea43ea6389f8407a8bda8b1b1becd30e41dfbb3dd9bebbe69816d096fa9	common_voice_ca_35266873.mp3	Apunta a l'agenda el número del Noah Barrull: sis, setanta-nou, noranta-tres, quaranta, dinou.	2	0	sixties	male	central	ca	
85c9e13ccfc0d67de10281b04257d8ac0c256d2f9415e54148fb59954c0d43f66d3cbea43ea6389f8407a8bda8b1b1becd30e41dfbb3dd9bebbe69816d096fa9	common_voice_ca_35283881.mp3	Durant la transició, qui ho pagarà, això?	2	0	sixties	male	central	ca	
85c9e13ccfc0d67de10281b04257d8ac0c256d2f9415e54148fb59954c0d43f66d3cbea43ea6389f8407a8bda8b1b1becd30e41dfbb3dd9bebbe69816d096fa9	common_voice_ca_35283914.mp3	Alfons Quera i Carré és un historiador i polític nascut a Barcelona.	2	0	sixties	male	central	ca	
85c9e13ccfc0d67de10281b04257d8ac0c256d2f9415e54148fb59954c0d43f66d3cbea43ea6389f8407a8bda8b1b1becd30e41dfbb3dd9bebbe69816d096fa9	common_voice_ca_35283940.mp3	Observació reactiva és aquella en què les persones saben que estan sent estudiades per l'investigador.	2	0	sixties	male	central	ca	
85c9e13ccfc0d67de10281b04257d8ac0c256d2f9415e54148fb59954c0d43f66d3cbea43ea6389f8407a8bda8b1b1becd30e41dfbb3dd9bebbe69816d096fa9	common_voice_ca_35299110.mp3	Conté les tombes de diversos centenars de soldats soviètics i txecoslovacs.	2	0	sixties	male	central	ca	
85c9e13ccfc0d67de10281b04257d8ac0c256d2f9415e54148fb59954c0d43f66d3cbea43ea6389f8407a8bda8b1b1becd30e41dfbb3dd9bebbe69816d096fa9	common_voice_ca_35299136.mp3	L'interior de l'estructura presenta els paraments arrebossats i pintats de color groc.	2	0	sixties	male	central	ca	
85c9e13ccfc0d67de10281b04257d8ac0c256d2f9415e54148fb59954c0d43f66d3cbea43ea6389f8407a8bda8b1b1becd30e41dfbb3dd9bebbe69816d096fa9	common_voice_ca_35299183.mp3	L'edifici alt presenta una estructura de jàsseres de formigó, biguetes i revoltons.	2	0	sixties	male	central	ca	
85c9e13ccfc0d67de10281b04257d8ac0c256d2f9415e54148fb59954c0d43f66d3cbea43ea6389f8407a8bda8b1b1becd30e41dfbb3dd9bebbe69816d096fa9	common_voice_ca_35299211.mp3	Va seguir una ràpida decadència i despoblació.	2	0	sixties	male	central	ca	
85c9e13ccfc0d67de10281b04257d8ac0c256d2f9415e54148fb59954c0d43f66d3cbea43ea6389f8407a8bda8b1b1becd30e41dfbb3dd9bebbe69816d096fa9	common_voice_ca_35299284.mp3	No m'ha caigut res.	2	0	sixties	male	central	ca	
85c9e13ccfc0d67de10281b04257d8ac0c256d2f9415e54148fb59954c0d43f66d3cbea43ea6389f8407a8bda8b1b1becd30e41dfbb3dd9bebbe69816d096fa9	common_voice_ca_35299451.mp3	Aquesta part consta de planta baixa i un pis.	2	0	sixties	male	central	ca	
85c9e13ccfc0d67de10281b04257d8ac0c256d2f9415e54148fb59954c0d43f66d3cbea43ea6389f8407a8bda8b1b1becd30e41dfbb3dd9bebbe69816d096fa9	common_voice_ca_35299489.mp3	Demà na Dàlia vol anar a visitar mon oncle.	2	0	sixties	male	central	ca	
85c9e13ccfc0d67de10281b04257d8ac0c256d2f9415e54148fb59954c0d43f66d3cbea43ea6389f8407a8bda8b1b1becd30e41dfbb3dd9bebbe69816d096fa9	common_voice_ca_35305136.mp3	Una clàssica confusió còmica converteix en heroi nacional a qui en realitat no ho és.	2	0	sixties	male	central	ca	
85c9e13ccfc0d67de10281b04257d8ac0c256d2f9415e54148fb59954c0d43f66d3cbea43ea6389f8407a8bda8b1b1becd30e41dfbb3dd9bebbe69816d096fa9	common_voice_ca_35305257.mp3	Les ampolles estan emmagatzemades i es tornen a l'embotellador en estoigs o caixes reutilitzables.	2	0	sixties	male	central	ca	
85c9e13ccfc0d67de10281b04257d8ac0c256d2f9415e54148fb59954c0d43f66d3cbea43ea6389f8407a8bda8b1b1becd30e41dfbb3dd9bebbe69816d096fa9	common_voice_ca_35305282.mp3	Doctor en Cànons per la Universitat de Toledo, on fou catedràtic.	2	0	sixties	male	central	ca	
85c9e13ccfc0d67de10281b04257d8ac0c256d2f9415e54148fb59954c0d43f66d3cbea43ea6389f8407a8bda8b1b1becd30e41dfbb3dd9bebbe69816d096fa9	common_voice_ca_35317816.mp3	La casa dels canonges i les cuines del monestir també es conserven acceptablement.	2	0	sixties	male	central	ca	
85c9e13ccfc0d67de10281b04257d8ac0c256d2f9415e54148fb59954c0d43f66d3cbea43ea6389f8407a8bda8b1b1becd30e41dfbb3dd9bebbe69816d096fa9	common_voice_ca_35317946.mp3	Igual que amb els “parrònims” proposats pel Jordi Graupera des de Lisboa.	2	0	sixties	male	central	ca	
85c9e13ccfc0d67de10281b04257d8ac0c256d2f9415e54148fb59954c0d43f66d3cbea43ea6389f8407a8bda8b1b1becd30e41dfbb3dd9bebbe69816d096fa9	common_voice_ca_35317947.mp3	Dimarts na Sança va a Sant Adrià de Besòs.	2	0	sixties	male	central	ca	
85c9e13ccfc0d67de10281b04257d8ac0c256d2f9415e54148fb59954c0d43f66d3cbea43ea6389f8407a8bda8b1b1becd30e41dfbb3dd9bebbe69816d096fa9	common_voice_ca_35322276.mp3	Dimecres na Nit i na Sira volen anar a Tremp.	2	0	sixties	male	central	ca	
85c9e13ccfc0d67de10281b04257d8ac0c256d2f9415e54148fb59954c0d43f66d3cbea43ea6389f8407a8bda8b1b1becd30e41dfbb3dd9bebbe69816d096fa9	common_voice_ca_35322341.mp3	Perquè avance, s’han de donar tres condicions.	2	0	sixties	male	central	ca	
85c9e13ccfc0d67de10281b04257d8ac0c256d2f9415e54148fb59954c0d43f66d3cbea43ea6389f8407a8bda8b1b1becd30e41dfbb3dd9bebbe69816d096fa9	common_voice_ca_35336429.mp3	Per Sant Jordi en Miquel voldria anar a Santa Cristina d'Aro.	2	0	sixties	male	central	ca	
85c9e13ccfc0d67de10281b04257d8ac0c256d2f9415e54148fb59954c0d43f66d3cbea43ea6389f8407a8bda8b1b1becd30e41dfbb3dd9bebbe69816d096fa9	common_voice_ca_35336571.mp3	També pot robar la pressa a un altre rapinyaire.	2	0	sixties	male	central	ca	
85c9e13ccfc0d67de10281b04257d8ac0c256d2f9415e54148fb59954c0d43f66d3cbea43ea6389f8407a8bda8b1b1becd30e41dfbb3dd9bebbe69816d096fa9	common_voice_ca_35336572.mp3	Dijous na Dolça vol anar a Esparreguera.	3	0	sixties	male	central	ca	
85c9e13ccfc0d67de10281b04257d8ac0c256d2f9415e54148fb59954c0d43f66d3cbea43ea6389f8407a8bda8b1b1becd30e41dfbb3dd9bebbe69816d096fa9	common_voice_ca_35349646.mp3	Demà en Nil irà a l'Argentera.	2	0	sixties	male	central	ca	
85c9e13ccfc0d67de10281b04257d8ac0c256d2f9415e54148fb59954c0d43f66d3cbea43ea6389f8407a8bda8b1b1becd30e41dfbb3dd9bebbe69816d096fa9	common_voice_ca_35373470.mp3	Manel Gausa de Mas és un fotògraf, actor i director de teatre nascut a Vic.	2	0	sixties	male	central	ca	
85c9e13ccfc0d67de10281b04257d8ac0c256d2f9415e54148fb59954c0d43f66d3cbea43ea6389f8407a8bda8b1b1becd30e41dfbb3dd9bebbe69816d096fa9	common_voice_ca_35423795.mp3	A l'edat mitjana, es va utilitzar sobretot per a imatges religioses i jocs de taula.	2	0	sixties	male	central	ca	
85c9e13ccfc0d67de10281b04257d8ac0c256d2f9415e54148fb59954c0d43f66d3cbea43ea6389f8407a8bda8b1b1becd30e41dfbb3dd9bebbe69816d096fa9	common_voice_ca_35423947.mp3	El termini de presentació de les sol·licituds s’allargarà fins al trenta de juny.	2	0	sixties	male	central	ca	
85c9e13ccfc0d67de10281b04257d8ac0c256d2f9415e54148fb59954c0d43f66d3cbea43ea6389f8407a8bda8b1b1becd30e41dfbb3dd9bebbe69816d096fa9	common_voice_ca_35464077.mp3	Hi ha moltes maneres de classificar les mides dels vehicles de llançament.	2	0	sixties	male	central	ca	
85c9e13ccfc0d67de10281b04257d8ac0c256d2f9415e54148fb59954c0d43f66d3cbea43ea6389f8407a8bda8b1b1becd30e41dfbb3dd9bebbe69816d096fa9	common_voice_ca_35464099.mp3	Demà passat en Maria irà a Queralbs.	2	0	sixties	male	central	ca	
85c9e13ccfc0d67de10281b04257d8ac0c256d2f9415e54148fb59954c0d43f66d3cbea43ea6389f8407a8bda8b1b1becd30e41dfbb3dd9bebbe69816d096fa9	common_voice_ca_35463986.mp3	Un noi jove amb caputxa i una noia s'arrupeixen a uns esglaons de fora d'unes portes grans.	2	0	sixties	male	central	ca	
85c9e13ccfc0d67de10281b04257d8ac0c256d2f9415e54148fb59954c0d43f66d3cbea43ea6389f8407a8bda8b1b1becd30e41dfbb3dd9bebbe69816d096fa9	common_voice_ca_35464942.mp3	Va ser construït a l'edat moderna i realitzat amb maons i pedra.	2	0	sixties	male	central	ca	
85c9e13ccfc0d67de10281b04257d8ac0c256d2f9415e54148fb59954c0d43f66d3cbea43ea6389f8407a8bda8b1b1becd30e41dfbb3dd9bebbe69816d096fa9	common_voice_ca_35653505.mp3	Demà na Mireia i na Cèlia volen anar a la Vilavella.	2	0	sixties	male	central	ca	
85c9e13ccfc0d67de10281b04257d8ac0c256d2f9415e54148fb59954c0d43f66d3cbea43ea6389f8407a8bda8b1b1becd30e41dfbb3dd9bebbe69816d096fa9	common_voice_ca_35653672.mp3	Dijous na Sança anirà a Riudarenes.	3	0	sixties	male	central	ca	
85c9e13ccfc0d67de10281b04257d8ac0c256d2f9415e54148fb59954c0d43f66d3cbea43ea6389f8407a8bda8b1b1becd30e41dfbb3dd9bebbe69816d096fa9	common_voice_ca_35653890.mp3	És internacional amb la selecció de Guinea Equatorial.	2	0	sixties	male	central	ca	
85c9e13ccfc0d67de10281b04257d8ac0c256d2f9415e54148fb59954c0d43f66d3cbea43ea6389f8407a8bda8b1b1becd30e41dfbb3dd9bebbe69816d096fa9	common_voice_ca_35680936.mp3	Xavier Jounou i Bajo va ser un polític nascut a Solsona.	2	0	sixties	male	central	ca	
85c9e13ccfc0d67de10281b04257d8ac0c256d2f9415e54148fb59954c0d43f66d3cbea43ea6389f8407a8bda8b1b1becd30e41dfbb3dd9bebbe69816d096fa9	common_voice_ca_35681595.mp3	Per Sant Jordi na Cloè i na Cora volen anar a Horta de Sant Joan.	2	0	sixties	male	central	ca	
85c9e13ccfc0d67de10281b04257d8ac0c256d2f9415e54148fb59954c0d43f66d3cbea43ea6389f8407a8bda8b1b1becd30e41dfbb3dd9bebbe69816d096fa9	common_voice_ca_35717174.mp3	Per Sant Jordi en Quel i na Mariona aniran a la platja.	3	0	sixties	male	central	ca	
85c9e13ccfc0d67de10281b04257d8ac0c256d2f9415e54148fb59954c0d43f66d3cbea43ea6389f8407a8bda8b1b1becd30e41dfbb3dd9bebbe69816d096fa9	common_voice_ca_35784627.mp3	El nou d'octubre en Genís i na Dolça aniran a Forcall.	2	0	sixties	male	central	ca	
85c9e13ccfc0d67de10281b04257d8ac0c256d2f9415e54148fb59954c0d43f66d3cbea43ea6389f8407a8bda8b1b1becd30e41dfbb3dd9bebbe69816d096fa9	common_voice_ca_35784782.mp3	Les proves en massa les van realitzar un centenar diari de sanitaris.	2	0	sixties	male	central	ca	
85c9e13ccfc0d67de10281b04257d8ac0c256d2f9415e54148fb59954c0d43f66d3cbea43ea6389f8407a8bda8b1b1becd30e41dfbb3dd9bebbe69816d096fa9	common_voice_ca_35784863.mp3	Divendres na Dèlia i na Nit iran a Riola.	2	0	sixties	male	central	ca	
85c9e13ccfc0d67de10281b04257d8ac0c256d2f9415e54148fb59954c0d43f66d3cbea43ea6389f8407a8bda8b1b1becd30e41dfbb3dd9bebbe69816d096fa9	common_voice_ca_35784769.mp3	Està ordenat alfabèticament per títol.	2	0	sixties	male	central	ca	
85c9e13ccfc0d67de10281b04257d8ac0c256d2f9415e54148fb59954c0d43f66d3cbea43ea6389f8407a8bda8b1b1becd30e41dfbb3dd9bebbe69816d096fa9	common_voice_ca_36287989.mp3	Tingui present que la llista no conté les parròquies que existien en aquella data.	2	0	sixties	male	central	ca	
85c9e13ccfc0d67de10281b04257d8ac0c256d2f9415e54148fb59954c0d43f66d3cbea43ea6389f8407a8bda8b1b1becd30e41dfbb3dd9bebbe69816d096fa9	common_voice_ca_36300085.mp3	Dijous na Cel i en Nil aniran a Clariana de Cardener.	2	0	sixties	male	central	ca	
85c9e13ccfc0d67de10281b04257d8ac0c256d2f9415e54148fb59954c0d43f66d3cbea43ea6389f8407a8bda8b1b1becd30e41dfbb3dd9bebbe69816d096fa9	common_voice_ca_36309603.mp3	Són incompliments; els recordarem però no anem a negociar-los, ha declarat.	2	0	sixties	male	central	ca	
85c9e13ccfc0d67de10281b04257d8ac0c256d2f9415e54148fb59954c0d43f66d3cbea43ea6389f8407a8bda8b1b1becd30e41dfbb3dd9bebbe69816d096fa9	common_voice_ca_36328301.mp3	Joan Boix Masramon va ser un cantant nascut a Barcelona.	2	0	sixties	male	central	ca	
2b59e9f830e5ea00c500b63eff4e72553e0c2608f5741d35c226e733400412014d7697bd6efb67bc61b19fd61e40f9ed70fde2589fe0b5498915eebc1c8b5d93	common_voice_ca_34935864.mp3	Malgrat això, McClatchy va decidir immediatament revendre dotze d'aquests papers per diverses raons.	6	0	fourties	male	nord-occidental,Tortosí	ca	
2b59e9f830e5ea00c500b63eff4e72553e0c2608f5741d35c226e733400412014d7697bd6efb67bc61b19fd61e40f9ed70fde2589fe0b5498915eebc1c8b5d93	common_voice_ca_34935875.mp3	I fer-ho en un context preelectoral o electoral no és fàcil.	3	0	fourties	male	nord-occidental,Tortosí	ca	
2b59e9f830e5ea00c500b63eff4e72553e0c2608f5741d35c226e733400412014d7697bd6efb67bc61b19fd61e40f9ed70fde2589fe0b5498915eebc1c8b5d93	common_voice_ca_34935876.mp3	Musser i West Hill.	3	0	fourties	male	nord-occidental,Tortosí	ca	
2b59e9f830e5ea00c500b63eff4e72553e0c2608f5741d35c226e733400412014d7697bd6efb67bc61b19fd61e40f9ed70fde2589fe0b5498915eebc1c8b5d93	common_voice_ca_34935919.mp3	Dijous na Bruna va a Crevillent.	3	0	fourties	male	nord-occidental,Tortosí	ca	
2b59e9f830e5ea00c500b63eff4e72553e0c2608f5741d35c226e733400412014d7697bd6efb67bc61b19fd61e40f9ed70fde2589fe0b5498915eebc1c8b5d93	common_voice_ca_34935974.mp3	Mentre durin les obres s’aturarà l’activitat del refugi.	9	0	fourties	male	nord-occidental,Tortosí	ca	
2b59e9f830e5ea00c500b63eff4e72553e0c2608f5741d35c226e733400412014d7697bd6efb67bc61b19fd61e40f9ed70fde2589fe0b5498915eebc1c8b5d93	common_voice_ca_34936010.mp3	Amb la teva exposició has retratat la situació en què es troba aquesta gent.	3	0	fourties	male	nord-occidental,Tortosí	ca	
2b59e9f830e5ea00c500b63eff4e72553e0c2608f5741d35c226e733400412014d7697bd6efb67bc61b19fd61e40f9ed70fde2589fe0b5498915eebc1c8b5d93	common_voice_ca_34936028.mp3	Ara som en una ensopegada, doncs ens aixecarem i continuarem, ha afirmat.	3	0	fourties	male	nord-occidental,Tortosí	ca	
2b59e9f830e5ea00c500b63eff4e72553e0c2608f5741d35c226e733400412014d7697bd6efb67bc61b19fd61e40f9ed70fde2589fe0b5498915eebc1c8b5d93	common_voice_ca_34936077.mp3	Sí, que podries —responc—.	3	0	fourties	male	nord-occidental,Tortosí	ca	
2b59e9f830e5ea00c500b63eff4e72553e0c2608f5741d35c226e733400412014d7697bd6efb67bc61b19fd61e40f9ed70fde2589fe0b5498915eebc1c8b5d93	common_voice_ca_34936095.mp3	Ningú no mou ni un múscul.	3	0	fourties	male	nord-occidental,Tortosí	ca	
2b59e9f830e5ea00c500b63eff4e72553e0c2608f5741d35c226e733400412014d7697bd6efb67bc61b19fd61e40f9ed70fde2589fe0b5498915eebc1c8b5d93	common_voice_ca_34936118.mp3	Dimecres en Nil i na Vera van a Sarroca de Lleida.	3	0	fourties	male	nord-occidental,Tortosí	ca	
2b59e9f830e5ea00c500b63eff4e72553e0c2608f5741d35c226e733400412014d7697bd6efb67bc61b19fd61e40f9ed70fde2589fe0b5498915eebc1c8b5d93	common_voice_ca_34936119.mp3	Dimarts en Jordi i en Pau van a la Vall d'Ebo.	3	0	fourties	male	nord-occidental,Tortosí	ca	
2b59e9f830e5ea00c500b63eff4e72553e0c2608f5741d35c226e733400412014d7697bd6efb67bc61b19fd61e40f9ed70fde2589fe0b5498915eebc1c8b5d93	common_voice_ca_34936137.mp3	Aquesta pel·lícula també es va estrenar amb el nom "Calling All Cats".	3	0	fourties	male	nord-occidental,Tortosí	ca	
2b59e9f830e5ea00c500b63eff4e72553e0c2608f5741d35c226e733400412014d7697bd6efb67bc61b19fd61e40f9ed70fde2589fe0b5498915eebc1c8b5d93	common_voice_ca_34936145.mp3	Tu vius en un altre segle.	3	0	fourties	male	nord-occidental,Tortosí	ca	
2b59e9f830e5ea00c500b63eff4e72553e0c2608f5741d35c226e733400412014d7697bd6efb67bc61b19fd61e40f9ed70fde2589fe0b5498915eebc1c8b5d93	common_voice_ca_34936869.mp3	La part inversa de la bandera tenia una planta de cotó amb una rattlesnake enroscada.	3	0	fourties	male	nord-occidental,Tortosí	ca	
2b59e9f830e5ea00c500b63eff4e72553e0c2608f5741d35c226e733400412014d7697bd6efb67bc61b19fd61e40f9ed70fde2589fe0b5498915eebc1c8b5d93	common_voice_ca_34936870.mp3	Tenim una societat civil imparable.	9	0	fourties	male	nord-occidental,Tortosí	ca	
2b59e9f830e5ea00c500b63eff4e72553e0c2608f5741d35c226e733400412014d7697bd6efb67bc61b19fd61e40f9ed70fde2589fe0b5498915eebc1c8b5d93	common_voice_ca_34936872.mp3	Tots els qui ho volem, hi hem de ser.	3	0	fourties	male	nord-occidental,Tortosí	ca	
2b59e9f830e5ea00c500b63eff4e72553e0c2608f5741d35c226e733400412014d7697bd6efb67bc61b19fd61e40f9ed70fde2589fe0b5498915eebc1c8b5d93	common_voice_ca_34936883.mp3	Només puc dir-vos que és força elemental, benvolguts lectors.	6	0	fourties	male	nord-occidental,Tortosí	ca	
2b59e9f830e5ea00c500b63eff4e72553e0c2608f5741d35c226e733400412014d7697bd6efb67bc61b19fd61e40f9ed70fde2589fe0b5498915eebc1c8b5d93	common_voice_ca_34936892.mp3	El castell va ser construït originàriament de fusta, pi principalment.	6	0	fourties	male	nord-occidental,Tortosí	ca	
2b59e9f830e5ea00c500b63eff4e72553e0c2608f5741d35c226e733400412014d7697bd6efb67bc61b19fd61e40f9ed70fde2589fe0b5498915eebc1c8b5d93	common_voice_ca_34936918.mp3	Ell tampoc està d’acord amb la manera de fer de la junta.	6	0	fourties	male	nord-occidental,Tortosí	ca	
2b59e9f830e5ea00c500b63eff4e72553e0c2608f5741d35c226e733400412014d7697bd6efb67bc61b19fd61e40f9ed70fde2589fe0b5498915eebc1c8b5d93	common_voice_ca_34936967.mp3	El vint-i-nou de febrer na Maria i n'Oriol volen anar a Almiserà.	6	0	fourties	male	nord-occidental,Tortosí	ca	
2b59e9f830e5ea00c500b63eff4e72553e0c2608f5741d35c226e733400412014d7697bd6efb67bc61b19fd61e40f9ed70fde2589fe0b5498915eebc1c8b5d93	common_voice_ca_34936969.mp3	El deu d'agost en Max voldria anar a Sant Feliu de Codines.	6	0	fourties	male	nord-occidental,Tortosí	ca	
2b59e9f830e5ea00c500b63eff4e72553e0c2608f5741d35c226e733400412014d7697bd6efb67bc61b19fd61e40f9ed70fde2589fe0b5498915eebc1c8b5d93	common_voice_ca_34936972.mp3	Amb tot això, aconseguim una visibilització de la demanda d’energia verda.	3	0	fourties	male	nord-occidental,Tortosí	ca	
2b59e9f830e5ea00c500b63eff4e72553e0c2608f5741d35c226e733400412014d7697bd6efb67bc61b19fd61e40f9ed70fde2589fe0b5498915eebc1c8b5d93	common_voice_ca_34936977.mp3	El vint-i-nou de febrer na Berta i en Lluc aniran a l'Aleixar.	6	0	fourties	male	nord-occidental,Tortosí	ca	
2b59e9f830e5ea00c500b63eff4e72553e0c2608f5741d35c226e733400412014d7697bd6efb67bc61b19fd61e40f9ed70fde2589fe0b5498915eebc1c8b5d93	common_voice_ca_34936991.mp3	Com puc fer la reserva llavors?	3	0	fourties	male	nord-occidental,Tortosí	ca	
2b59e9f830e5ea00c500b63eff4e72553e0c2608f5741d35c226e733400412014d7697bd6efb67bc61b19fd61e40f9ed70fde2589fe0b5498915eebc1c8b5d93	common_voice_ca_34936999.mp3	Dijous en Ton i na Cèlia aniran a Godall.	3	0	fourties	male	nord-occidental,Tortosí	ca	
2b59e9f830e5ea00c500b63eff4e72553e0c2608f5741d35c226e733400412014d7697bd6efb67bc61b19fd61e40f9ed70fde2589fe0b5498915eebc1c8b5d93	common_voice_ca_34946822.mp3	David Bertran Román és un politòleg i polític nascut a Lleida.	6	0	fourties	male	nord-occidental,Tortosí	ca	
2b59e9f830e5ea00c500b63eff4e72553e0c2608f5741d35c226e733400412014d7697bd6efb67bc61b19fd61e40f9ed70fde2589fe0b5498915eebc1c8b5d93	common_voice_ca_34946874.mp3	El vint-i-tres de maig en Mirt i en Genís aniran al Cogul.	6	0	fourties	male	nord-occidental,Tortosí	ca	
2b59e9f830e5ea00c500b63eff4e72553e0c2608f5741d35c226e733400412014d7697bd6efb67bc61b19fd61e40f9ed70fde2589fe0b5498915eebc1c8b5d93	common_voice_ca_34946937.mp3	El deu d'agost na Carlota i en Gaël van a Ripoll.	6	0	fourties	male	nord-occidental,Tortosí	ca	
2b59e9f830e5ea00c500b63eff4e72553e0c2608f5741d35c226e733400412014d7697bd6efb67bc61b19fd61e40f9ed70fde2589fe0b5498915eebc1c8b5d93	common_voice_ca_34946968.mp3	Per Sant Jordi en Sergi anirà a la biblioteca.	3	0	fourties	male	nord-occidental,Tortosí	ca	
2b59e9f830e5ea00c500b63eff4e72553e0c2608f5741d35c226e733400412014d7697bd6efb67bc61b19fd61e40f9ed70fde2589fe0b5498915eebc1c8b5d93	common_voice_ca_34946969.mp3	Demà na Bruna i na Beth van a Bocairent.	6	0	fourties	male	nord-occidental,Tortosí	ca	
2b59e9f830e5ea00c500b63eff4e72553e0c2608f5741d35c226e733400412014d7697bd6efb67bc61b19fd61e40f9ed70fde2589fe0b5498915eebc1c8b5d93	common_voice_ca_34947002.mp3	El barret nord-americà té estrelles blaves i ratlles vermelles, queda preciós en aquesta noia.	3	0	fourties	male	nord-occidental,Tortosí	ca	
2b59e9f830e5ea00c500b63eff4e72553e0c2608f5741d35c226e733400412014d7697bd6efb67bc61b19fd61e40f9ed70fde2589fe0b5498915eebc1c8b5d93	common_voice_ca_34947025.mp3	El deu d'agost en Lluc i na Carla van a Santa Margarida de Montbui.	6	0	fourties	male	nord-occidental,Tortosí	ca	
2b59e9f830e5ea00c500b63eff4e72553e0c2608f5741d35c226e733400412014d7697bd6efb67bc61b19fd61e40f9ed70fde2589fe0b5498915eebc1c8b5d93	common_voice_ca_34956231.mp3	Dels llibres, dels lectors, dels bibliotecaris, dels editors, dels llibreters.	3	0	fourties	male	nord-occidental,Tortosí	ca	
2b59e9f830e5ea00c500b63eff4e72553e0c2608f5741d35c226e733400412014d7697bd6efb67bc61b19fd61e40f9ed70fde2589fe0b5498915eebc1c8b5d93	common_voice_ca_34956232.mp3	La ciutat va ser nomenada en honor a R.H. Hankinson, un terratinent local.	3	0	fourties	male	nord-occidental,Tortosí	ca	
2b59e9f830e5ea00c500b63eff4e72553e0c2608f5741d35c226e733400412014d7697bd6efb67bc61b19fd61e40f9ed70fde2589fe0b5498915eebc1c8b5d93	common_voice_ca_34956235.mp3	Un dels aspectes més estudiats ha estat el camuflatge.	3	0	fourties	male	nord-occidental,Tortosí	ca	
2b59e9f830e5ea00c500b63eff4e72553e0c2608f5741d35c226e733400412014d7697bd6efb67bc61b19fd61e40f9ed70fde2589fe0b5498915eebc1c8b5d93	common_voice_ca_34956236.mp3	El nou d'octubre na Neida anirà a visitar mon oncle.	3	0	fourties	male	nord-occidental,Tortosí	ca	
2b59e9f830e5ea00c500b63eff4e72553e0c2608f5741d35c226e733400412014d7697bd6efb67bc61b19fd61e40f9ed70fde2589fe0b5498915eebc1c8b5d93	common_voice_ca_34959014.mp3	Josep Mestres i Cabanes va ser un pintor i escenògraf nascut a Manresa.	6	0	fourties	male	nord-occidental,Tortosí	ca	
2b59e9f830e5ea00c500b63eff4e72553e0c2608f5741d35c226e733400412014d7697bd6efb67bc61b19fd61e40f9ed70fde2589fe0b5498915eebc1c8b5d93	common_voice_ca_34959019.mp3	Divendres na Carlota anirà al teatre.	3	0	fourties	male	nord-occidental,Tortosí	ca	
2b59e9f830e5ea00c500b63eff4e72553e0c2608f5741d35c226e733400412014d7697bd6efb67bc61b19fd61e40f9ed70fde2589fe0b5498915eebc1c8b5d93	common_voice_ca_34959783.mp3	Va formar-se a al George Watson's College i després va estudiar Dret a la Universitat d'Edimburg.	6	0	fourties	male	nord-occidental,Tortosí	ca	
